{
  "extract_sha256": "239c8b0e74946542237287f41674abbf7da5933eda3b4007f17cfd6290b2e577",
  "lines": [
    {
      "classification": "CONTEXT",
      "line": 221,
      "requirements": [],
      "source_fragment": "Part 3 \u2014 Managed AWS platform"
    },
    {
      "classification": "CONTEXT",
      "line": 222,
      "requirements": [],
      "source_fragment": "Objective"
    },
    {
      "classification": "NORMATIVE",
      "line": 223,
      "requirements": [
        "P3-M-L223-01",
        "P3-M-L223-02",
        "P3-M-L223-03",
        "P3-M-L223-04",
        "P3-M-L223-05"
      ],
      "source_fragment": "Prove that the current source can safely deploy, validate, and destroy the minimal LedgerGuard AWS platform before any reconciliation workload runs."
    },
    {
      "classification": "CONTEXT",
      "line": 224,
      "requirements": [],
      "source_fragment": "Workstream 1: AWS environment qualification"
    },
    {
      "classification": "CONTEXT",
      "line": 225,
      "requirements": [],
      "source_fragment": "Before Terraform apply:"
    },
    {
      "classification": "NORMATIVE",
      "line": 226,
      "requirements": [
        "P3-M-L226-01"
      ],
      "source_fragment": "* Verify OIDC identity."
    },
    {
      "classification": "NORMATIVE",
      "line": 227,
      "requirements": [
        "P3-M-L227-01",
        "P3-M-L227-02"
      ],
      "source_fragment": "* Verify exact account and ap-southeast-2."
    },
    {
      "classification": "NORMATIVE",
      "line": 228,
      "requirements": [
        "P3-M-L228-01",
        "P3-M-L228-02"
      ],
      "source_fragment": "* Verify repository and main trust boundary."
    },
    {
      "classification": "NORMATIVE",
      "line": 229,
      "requirements": [
        "P3-M-L229-01"
      ],
      "source_fragment": "* Compare live IAM with checked-in IAM."
    },
    {
      "classification": "NORMATIVE",
      "line": 230,
      "requirements": [
        "P3-M-L230-01"
      ],
      "source_fragment": "* Verify backend access."
    },
    {
      "classification": "NORMATIVE",
      "line": 231,
      "requirements": [
        "P3-M-L231-01"
      ],
      "source_fragment": "* Verify lease behavior."
    },
    {
      "classification": "NORMATIVE",
      "line": 232,
      "requirements": [
        "P3-M-L232-01"
      ],
      "source_fragment": "* Verify budget headroom."
    },
    {
      "classification": "NORMATIVE",
      "line": 233,
      "requirements": [
        "P3-M-L233-01"
      ],
      "source_fragment": "* Verify S3 capabilities."
    },
    {
      "classification": "NORMATIVE",
      "line": 234,
      "requirements": [
        "P3-M-L234-01",
        "P3-M-L234-02",
        "P3-M-L234-03"
      ],
      "source_fragment": "* Verify Glue definition create/read/delete."
    },
    {
      "classification": "NORMATIVE",
      "line": 235,
      "requirements": [
        "P3-M-L235-01"
      ],
      "source_fragment": "* Verify Step Functions definition validation."
    },
    {
      "classification": "NORMATIVE",
      "line": 236,
      "requirements": [
        "P3-M-L236-01"
      ],
      "source_fragment": "* Verify Athena workgroup access."
    },
    {
      "classification": "NORMATIVE",
      "line": 237,
      "requirements": [
        "P3-M-L237-01"
      ],
      "source_fragment": "* Verify CloudWatch evidence access."
    },
    {
      "classification": "NORMATIVE",
      "line": 238,
      "requirements": [
        "P3-M-L238-01"
      ],
      "source_fragment": "* Prove no active LedgerGuard workload resources exist."
    },
    {
      "classification": "NORMATIVE",
      "line": 239,
      "requirements": [
        "P3-M-L239-01"
      ],
      "source_fragment": "CloudShell will not be a dependency."
    },
    {
      "classification": "CONTEXT",
      "line": 240,
      "requirements": [],
      "source_fragment": "Workstream 2: Minimal infrastructure implementation"
    },
    {
      "classification": "CONTEXT",
      "line": 241,
      "requirements": [],
      "source_fragment": "Expected infrastructure:"
    },
    {
      "classification": "NORMATIVE",
      "line": 242,
      "requirements": [
        "P3-M-L242-01",
        "P3-M-L242-02",
        "P3-M-L242-03",
        "P3-M-L242-04",
        "P3-M-L242-05"
      ],
      "source_fragment": "* One versioned, encrypted, private workload bucket with isolated prefixes."
    },
    {
      "classification": "NORMATIVE",
      "line": 243,
      "requirements": [
        "P3-M-L243-01",
        "P3-M-L243-02"
      ],
      "source_fragment": "* Lifecycle and incomplete multipart-upload cleanup."
    },
    {
      "classification": "NORMATIVE",
      "line": 244,
      "requirements": [
        "P3-M-L244-01",
        "P3-M-L244-02"
      ],
      "source_fragment": "* Glue database and tables where required."
    },
    {
      "classification": "NORMATIVE",
      "line": 245,
      "requirements": [
        "P3-M-L245-01"
      ],
      "source_fragment": "* One Glue 5.1 reconciliation job."
    },
    {
      "classification": "NORMATIVE",
      "line": 246,
      "requirements": [
        "P3-M-L246-01"
      ],
      "source_fragment": "* One real Step Functions workflow."
    },
    {
      "classification": "NORMATIVE",
      "line": 247,
      "requirements": [
        "P3-M-L247-01"
      ],
      "source_fragment": "* One DynamoDB control/case table or two small tables if separation is clearer."
    },
    {
      "classification": "NORMATIVE",
      "line": 248,
      "requirements": [
        "P3-M-L248-01"
      ],
      "source_fragment": "* One bounded Athena workgroup."
    },
    {
      "classification": "NORMATIVE",
      "line": 249,
      "requirements": [
        "P3-M-L249-01",
        "P3-M-L249-02"
      ],
      "source_fragment": "* CloudWatch log groups and metrics."
    },
    {
      "classification": "NORMATIVE",
      "line": 250,
      "requirements": [
        "P3-M-L250-01"
      ],
      "source_fragment": "* Exact workload roles."
    },
    {
      "classification": "NORMATIVE",
      "line": 251,
      "requirements": [
        "P3-M-L251-01"
      ],
      "source_fragment": "* Repository OIDC policy."
    },
    {
      "classification": "NORMATIVE",
      "line": 252,
      "requirements": [
        "P3-M-L252-01",
        "P3-M-L252-02"
      ],
      "source_fragment": "* Terraform backend and lease integration."
    },
    {
      "classification": "NORMATIVE",
      "line": 253,
      "requirements": [
        "P3-M-L253-01"
      ],
      "source_fragment": "Every resource must justify a project requirement."
    },
    {
      "classification": "CONTEXT",
      "line": 254,
      "requirements": [],
      "source_fragment": "Workstream 3: Real orchestration"
    },
    {
      "classification": "CONTEXT",
      "line": 255,
      "requirements": [],
      "source_fragment": "The state machine will perform:"
    },
    {
      "classification": "NORMATIVE",
      "line": 256,
      "requirements": [
        "P3-M-L256-01",
        "P3-M-L256-02"
      ],
      "source_fragment": "1. Validate run and manifest identity."
    },
    {
      "classification": "NORMATIVE",
      "line": 257,
      "requirements": [
        "P3-M-L257-01"
      ],
      "source_fragment": "2. Conditionally register the run."
    },
    {
      "classification": "NORMATIVE",
      "line": 258,
      "requirements": [
        "P3-M-L258-01"
      ],
      "source_fragment": "3. Execute Glue through .sync."
    },
    {
      "classification": "NORMATIVE",
      "line": 259,
      "requirements": [
        "P3-M-L259-01"
      ],
      "source_fragment": "4. Independently validate produced results."
    },
    {
      "classification": "NORMATIVE",
      "line": 260,
      "requirements": [
        "P3-M-L260-01"
      ],
      "source_fragment": "5. Run bounded Athena checks."
    },
    {
      "classification": "NORMATIVE",
      "line": 261,
      "requirements": [
        "P3-M-L261-01",
        "P3-M-L261-02"
      ],
      "source_fragment": "6. Persist the reconciliation summary and case revisions."
    },
    {
      "classification": "NORMATIVE",
      "line": 262,
      "requirements": [
        "P3-M-L262-01"
      ],
      "source_fragment": "7. Finalize only when required evidence exists."
    },
    {
      "classification": "NORMATIVE",
      "line": 263,
      "requirements": [
        "P3-M-L263-01"
      ],
      "source_fragment": "8. Preserve exact failure state when a step fails."
    },
    {
      "classification": "NORMATIVE",
      "line": 264,
      "requirements": [
        "P3-M-L264-01"
      ],
      "source_fragment": "No placeholder states may remain."
    },
    {
      "classification": "CONTEXT",
      "line": 265,
      "requirements": [],
      "source_fragment": "Workstream 4: Security and cost controls"
    },
    {
      "classification": "NORMATIVE",
      "line": 266,
      "requirements": [
        "P3-M-L266-01",
        "P3-M-L266-02"
      ],
      "source_fragment": "* Main-branch and manual-dispatch restrictions."
    },
    {
      "classification": "NORMATIVE",
      "line": 267,
      "requirements": [
        "P3-M-L267-01"
      ],
      "source_fragment": "* Short-lived OIDC credentials."
    },
    {
      "classification": "NORMATIVE",
      "line": 268,
      "requirements": [
        "P3-M-L268-01"
      ],
      "source_fragment": "* Least-privilege execution roles."
    },
    {
      "classification": "NORMATIVE",
      "line": 269,
      "requirements": [
        "P3-M-L269-01",
        "P3-M-L269-02"
      ],
      "source_fragment": "* Private S3 and TLS-only access."
    },
    {
      "classification": "NORMATIVE",
      "line": 270,
      "requirements": [
        "P3-M-L270-01"
      ],
      "source_fragment": "* Synthetic data only."
    },
    {
      "classification": "NORMATIVE",
      "line": 271,